circle,album,title,vocalists,arrangers,lyricists,original_songs,track_number,event
Retractable,Awakening World,覚醒,,つきいち,,地霊達の起床,1,博麗神社例大祭11
Retractable,Awakening World,Eye of xxxx,,つきいち,,ハルトマンの妖怪少女,2,博麗神社例大祭11
Retractable,Awakening World,おもちゃのゆめ(Devastating),,つきいち,,U.N.オーエンは彼女なのか？,3,博麗神社例大祭11
Retractable,Awakening World,fluster,,つきいち,,ラクトガール　〜 少女密室,4,博麗神社例大祭11
Retractable,Awakening World,Depths,,つきいち,,亡き王女の為のセプテット,5,博麗神社例大祭11
Retractable,Awakening World,わーぷわーるど！,,つきいち,,少女さとり　〜 3rd eye,6,博麗神社例大祭11
Retractable,Awakening World,停滞加速余命幾許,,つきいち,,月時計　〜 ルナ・ダイアル,7,博麗神社例大祭11
Retractable,Awakening World,願いはどこか懐かしい夢の話みたいだった,,つきいち,,夜空のユーフォーロマンス,8,博麗神社例大祭11
Retractable,Awakening World,思紅停止,,つきいち,,オリジナル,9,博麗神社例大祭11
