circle,album,title,vocalists,arrangers,lyricists,original_songs,track_number,event
こなぐすり,東方妖狸薬,スーパーマミゾウズ11,時花:加藤乃依,MiYAMO,夕野ヨシミ,佐渡の二ッ岩,1,コミックマーケット84
こなぐすり,東方妖狸薬,Rabbit Labyrinth,加藤乃依,ねっぴ,海兎,狂気の瞳　〜 Invisible Full Moon,2,コミックマーケット84
こなぐすり,東方妖狸薬,エンカツ!?エンカイカツドウ,ななひら,D.watt,七条レタス,華のさかづき大江山:旧地獄街道を行く:ネクロファンタジア:御伽の国の鬼が島　〜 Missing Power,3,コミックマーケット84
こなぐすり,東方妖狸薬,恋愛的☆モラトリアム,加藤乃依,溝口ゆうま,溝口ゆうま,恋色マスタースパーク,4,コミックマーケット84
こなぐすり,東方妖狸薬,＼(・ω・＼)産地!(/・ω・)/直送!芋娘!〜愛をこめてお届けします(はぁと)〜,時花,ねっぴ,時花:海兎,稲田姫様に叱られるから,5,コミックマーケット84
こなぐすり,東方妖狸薬,スーパーマミゾーズがゲームになったらこうなる。,,MiYAMO,,佐渡の二ッ岩,6,コミックマーケット84
