circle,album,title,vocalists,arrangers,lyricists,original_songs,track_number,event
荒御霊,拘束人形〜the Breakdown of Alice〜,人形師世界　〜 Cybercity,,和泉幸奇,,ブクレシュティの人形師,1,人形遣いのTea Party
荒御霊,拘束人形〜the Breakdown of Alice〜,高速人形　〜 the Breakdown of Alice,,和泉幸奇,,人形裁判　〜 人の形弄びし少女,2,人形遣いのTea Party
荒御霊,拘束人形〜the Breakdown of Alice〜,グラン・ギニョール　〜 Experimental,,和泉幸奇,,人形の森,3,人形遣いのTea Party
荒御霊,拘束人形〜the Breakdown of Alice〜,魔法の国のアリス　〜 near death Happiness,,和泉幸奇,,Romantic Children,4,人形遣いのTea Party
荒御霊,拘束人形〜the Breakdown of Alice〜,グラスチックアイ　〜 God bless you,,和泉幸奇,,プラスチックマインド,5,人形遣いのTea Party
荒御霊,拘束人形〜the Breakdown of Alice〜,人形の国のアリス　〜 Eclipse,,和泉幸奇,,the Grimoire of Alice,6,人形遣いのTea Party
荒御霊,拘束人形〜the Breakdown of Alice〜,幻想の国のアリス　〜 Springsnow,,和泉幸奇,,不思議の国のアリス,7,人形遣いのTea Party
荒御霊,拘束人形〜the Breakdown of Alice〜,拘束人形　〜 Taboo,,和泉幸奇,,その他,8,人形遣いのTea Party
荒御霊,拘束人形〜the Breakdown of Alice〜,M.R.Y神社にようこそ!,,和泉幸奇,,ネイティブフェイス,9,人形遣いのTea Party
