circle,album,title,vocalists,arrangers,lyricists,original_songs,track_number,event
石鹸屋,東方マグマー,不撓不屈のモーメント,厚志,石鹸屋,秀三,キャプテン・ムラサ,1,博麗神社例大祭8
石鹸屋,東方マグマー,寡黙なるフォール,厚志,石鹸屋,秀三,フォールオブフォール　〜 秋めく滝,2,博麗神社例大祭8
石鹸屋,東方マグマー,locked clock,秀三,石鹸屋,hellnian,ラクトガール　〜 少女密室,3,博麗神社例大祭8
石鹸屋,東方マグマー,UFOロマンス,厚志,石鹸屋,厚志:秀三:hellnian,夜空のユーフォーロマンス,4,博麗神社例大祭8
石鹸屋,東方マグマー,ファインダーダイバー,秀三,石鹸屋,hellnian,あなたの町の怪事件,5,博麗神社例大祭8
石鹸屋,東方マグマー,年中夢中×3,秀三,石鹸屋,hellnian,年中夢中の好奇心,6,博麗神社例大祭8
石鹸屋,東方マグマー,紅霧紅夢,厚志:秀三,石鹸屋,秀三,紅楼　〜 Eastern Dream...,7,博麗神社例大祭8
石鹸屋,東方マグマー,地獄の端にて君を待つ,厚志:秀三,石鹸屋,秀三,旧地獄街道を行く,8,博麗神社例大祭8
