circle,album,title,vocalists,arrangers,lyricists,original_songs,track_number,event
SYNC.ART'S,七星再臨,grown baby's breath,桃梨,五条下位,桃梨,幽霊楽団　〜 Phantom Ensemble,1,博麗神社例大祭3
SYNC.ART'S,七星再臨,今宵、雪舞う月夜に,結月そら,五条下位,結月そら,お宇佐さまの素い幡,2,博麗神社例大祭3
SYNC.ART'S,七星再臨,遥かなる時の幻想曲,美里,五条下位,,千年幻想郷　〜 History of the Moon,3,博麗神社例大祭3
SYNC.ART'S,七星再臨,烈風少女,,五条下位,,風神少女,4,博麗神社例大祭3
SYNC.ART'S,七星再臨,瀟洒な花は夜に咲く,,五条下位,,フラワリングナイト,5,博麗神社例大祭3
SYNC.ART'S,七星再臨,彼岸参りの銭落とし,,五条下位,,彼岸帰航　〜 Riverside View,6,博麗神社例大祭3
SYNC.ART'S,七星再臨,百七十の大罪,,五条下位,,六十年目の東方裁判　〜 Fate of Sixty Years,7,博麗神社例大祭3
