circle,album,title,vocalists,arrangers,lyricists,original_songs,track_number,event
虹色論理,"SCARLET YOU EP","チェリーティーブレイク","",,,,1,
虹色論理,"SCARLET YOU EP","スカーレットユー","",,,,2,
虹色論理,"SCARLET YOU EP","モーニンググローリー","",,,,3,
虹色論理,"SCARLET YOU EP","ソングバード","",,,,4,
虹色論理,"SCARLET YOU EP","チェリーティーブレイク off vocal track",,,,,5,
虹色論理,"SCARLET YOU EP","スカーレットユー off vocal track",,,,,6,
虹色論理,"SCARLET YOU EP","モーニンググローリー off vocal track",,,,,7,
虹色論理,"SCARLET YOU EP","ソングバード off vocal track",,,,,8,
虹色論理,"SCARLET YOU EP","Bonus Track","",,,,9,
