circle,album,title,vocalists,arrangers,lyricists,original_songs,track_number,event
Casket,"幻想パブ:午後8時　～ Teach tábhairne de fantaisíocht,8 um tráthnóna",Theas,,Escarmew,,旧地獄街道を行く:華のさかづき大江山,1,東方紅楼夢7
Casket,"幻想パブ:午後8時　～ Teach tábhairne de fantaisíocht,8 um tráthnóna",Thuaidh,,Escarmew,,萃夢想,2,東方紅楼夢7
Casket,"幻想パブ:午後8時　～ Teach tábhairne de fantaisíocht,8 um tráthnóna",Glas,,Escarmew,,渡る者の途絶えた橋:緑眼のジェラシー,3,東方紅楼夢7
Casket,"幻想パブ:午後8時　～ Teach tábhairne de fantaisíocht,8 um tráthnóna",Oráiste,,Escarmew,,遠野幻想物語:ティアオイエツォン(withered leaf),4,東方紅楼夢7
Casket,"幻想パブ:午後8時　～ Teach tábhairne de fantaisíocht,8 um tráthnóna",Creideamh - sean,,Escarmew,,少女綺想曲　～ Dream Battle,5,東方紅楼夢7
Casket,"幻想パブ:午後8時　～ Teach tábhairne de fantaisíocht,8 um tráthnóna",Creideamh - nua,,Escarmew,,信仰は儚き人間の為に,6,東方紅楼夢7
Casket,"幻想パブ:午後8時　～ Teach tábhairne de fantaisíocht,8 um tráthnóna",Mind the gap,,Escarmew,,ネクロファンタジア,7,東方紅楼夢7
Casket,"幻想パブ:午後8時　～ Teach tábhairne de fantaisíocht,8 um tráthnóna",The color stands for,,Escarmew,,オリジナル,8,東方紅楼夢7
