circle,album,title,vocalists,arrangers,lyricists,original_songs,track_number,event
monoROSETTA,Sweet Beat TV,Introduction,,void,,オリジナル,1,博麗神社例大祭9
monoROSETTA,Sweet Beat TV,Can You Love Me? Oh Yeah!,めらみぽっぷ,void,夕野ヨシミ,Demystify Feast:御伽の国の鬼が島　〜 Missing Power,2,博麗神社例大祭9
monoROSETTA,Sweet Beat TV,Midnight Wake Up,野宮あゆみ,void,夕野ヨシミ,素敵な墓場で暮しましょ:リジッドパラダイス,3,博麗神社例大祭9
monoROSETTA,Sweet Beat TV,Happy Cyciling,RENA,void,はかせ,メイドと血の懐中時計,4,博麗神社例大祭9
monoROSETTA,Sweet Beat TV,Dream in the afternoon,高井さん,void,オミ織葉,ヴワル魔法図書館:ラクトガール　〜 少女密室,5,博麗神社例大祭9
monoROSETTA,Sweet Beat TV,はらペコペコリ,岩杉夏,void,オミ織葉,魔界地方都市エソテリア:虎柄の毘沙門天,6,博麗神社例大祭9
monoROSETTA,Sweet Beat TV,Kiss Kiss Summer Day,RENA,void,夕野ヨシミ,今昔幻想郷　〜 Flower Land,7,博麗神社例大祭9
monoROSETTA,Sweet Beat TV,Rainy Day,高井さん,void,>>96:void,少女が見た日本の原風景:信仰は儚き人間の為に,8,博麗神社例大祭9
