circle,album,title,vocalists,arrangers,lyricists,original_songs,track_number,event
Azure&Sands,Casino聖輦船,カジノ聖輦船にようこそ,厚志,鯛の小骨,鯛の小骨,幽霊客船の時空を越えた旅,1,M3-2010春
Azure&Sands,Casino聖輦船,ブラックジャックでよろしく,,鯛の小骨,,春の湊に:小さな小さな賢将,2,M3-2010春
Azure&Sands,Casino聖輦船,あいつはイカサマをしている,あにー,鯛の小骨,鯛の小骨,魔界地方都市エソテリア:虎柄の毘沙門天,3,M3-2010春
Azure&Sands,Casino聖輦船,ハイカラブギ,,鯛の小骨,,時代親父とハイカラ少女,4,M3-2010春
Azure&Sands,Casino聖輦船,Royal Flush!,ichigo,鯛の小骨,鯛の小骨,キャプテン・ムラサ,5,M3-2010春
Azure&Sands,Casino聖輦船,憑いてるツいてるルーレット,,鯛の小骨,,万年置き傘にご注意を,6,M3-2010春
Azure&Sands,Casino聖輦船,スロニートプリンセスかぐや-S・N・P・K!-,神波千尋,鯛の小骨,鯛の小骨,竹取飛翔　〜 Lunatic Princess:春の湊に:夜空のユーフォーロマンス,7,M3-2010春
Azure&Sands,Casino聖輦船,当館は魔法使いの来館はご遠慮頂いております,,鯛の小骨,,感情の摩天楼　〜 Cosmic Mind,8,M3-2010春
