circle,album,title,vocalists,arrangers,lyricists,original_songs,track_number,event
K2 SOUND,宵麗 -SYOREI-,MyStyle MyLife,小峠舞,あとぐる,小峠舞,デザイアドライブ,1,東方紅楼夢9
K2 SOUND,宵麗 -SYOREI-,Horizon,真崎エリカ,K2,Amane Myu,妖魔夜行,2,東方紅楼夢9
K2 SOUND,宵麗 -SYOREI-,Boom Boom Satellite Cannon,,tsunamix,,狂気の瞳　〜 Invisible Full Moon,3,東方紅楼夢9
K2 SOUND,宵麗 -SYOREI-,紅い闇,ルキア,Sion,ルキア,幽雅に咲かせ、墨染の桜　〜 Border of Life,4,東方紅楼夢9
K2 SOUND,宵麗 -SYOREI-,Settlement of the past,,京箪笥,,ハルトマンの妖怪少女,5,東方紅楼夢9
K2 SOUND,宵麗 -SYOREI-,quiet storm in spanish,,創無頼人,,聖徳伝説　〜 True Administrator,6,東方紅楼夢9
K2 SOUND,宵麗 -SYOREI-,榛莽で輝くちっぽけな,,W*M,,小さな小さな賢将,7,東方紅楼夢9
K2 SOUND,宵麗 -SYOREI-,あなたは私の黒歴史,ANNA,美有耳虚無頭,美有耳虚無頭,神さびた古戦場　〜 Suwa Foughten Field,8,東方紅楼夢9
